{
  "schema_version": "0.1.0",
  "run_id": "RUN-OFS001-PILOT-003",
  "evaluated_at": "2026-08-23T17:35:38.207635Z",
  "status": "incomplete",
  "pilot_mode": true,
  "registry_digest": "2fc2cc21b8b3603d4988d97d71cac38971fcfa600001539652eeb0da2e5c5d5a",
  "policy_id": "CONSENSUS-BASELINE-001",
  "object_type_results": [
    {
      "object_type": "claim",
      "status": "incomplete",
      "checks": {
        "assessment_capacity": false,
        "independent_support_group_capacity": false,
        "falsification_capacity": true
      },
      "required": {
        "minimum_assessments": 3,
        "minimum_support_independence_groups": 2,
        "require_falsification_review": false
      },
      "available": {
        "reviewer_agent_ids": [
          "validator-public-01"
        ],
        "author_independence_groups": [
          "openai-gpt5-codex-interactive"
        ],
        "independent_reviewer_agent_ids": [],
        "independent_reviewer_groups": [],
        "independent_critic_agent_ids": []
      }
    }
  ],
  "unmet_requirements": [
    "claim:assessment_capacity",
    "claim:independent_support_group_capacity"
  ],
  "effect": "An incomplete preflight permits provisional research, but no proposal may be treated as formally accepted until the Consensus Gate passes."
}
