{
  "schema_version": "0.1.0",
  "run_id": "RUN-OFS003-PILOT-003",
  "evaluated_at": "2026-08-23T19:07:44.324065Z",
  "status": "incomplete",
  "pilot_mode": true,
  "registry_digest": "7df2f54496c83a0faf5d2799d0abc559bb0c2249d717d79fa76d280638c52516",
  "policy_id": "CONSENSUS-BASELINE-001",
  "object_type_results": [
    {
      "object_type": "center_profile",
      "status": "incomplete",
      "checks": {
        "assessment_capacity": false,
        "independent_support_group_capacity": false,
        "falsification_capacity": false
      },
      "required": {
        "minimum_assessments": 3,
        "minimum_support_independence_groups": 2,
        "require_falsification_review": true
      },
      "available": {
        "reviewer_agent_ids": [
          "validator-public-01"
        ],
        "author_independence_groups": [
          "openai-gpt5-codex-interactive"
        ],
        "independent_reviewer_agent_ids": [],
        "independent_reviewer_groups": [],
        "independent_critic_agent_ids": []
      }
    }
  ],
  "unmet_requirements": [
    "center_profile:assessment_capacity",
    "center_profile:falsification_capacity",
    "center_profile:independent_support_group_capacity"
  ],
  "effect": "An incomplete preflight permits provisional research, but no proposal may be treated as formally accepted until the Consensus Gate passes."
}
